{
  "$schema": "https://json-schema.org/draft/2020-12/schema",
  "$id": "https://data.bioregionaltwin.org/id/schema/place-set-binding-1.0.json",
  "title": "Place-set binding",
  "description": "A twin 'place set': the set of published twin ids one Kami entity senses through (architecture §3). Deliberately ignorant of the platform beyond entity_id. Ids are minted only by the twin; membership is the platform's guess until a steward freezes it.",
  "type": "object",
  "required": [
    "schema_version",
    "binding_version",
    "entity_id",
    "archetype",
    "anchor",
    "stream_id",
    "commons_handle",
    "members",
    "watersheds",
    "reach_ids",
    "boundary",
    "needs",
    "membership_rule",
    "frozen_at",
    "reviewed_by",
    "twin_index_etag"
  ],
  "additionalProperties": false,
  "$defs": {
    "placeId": {
      "type": "string",
      "pattern": "^[a-z_]+/[a-z0-9-]+$",
      "description": "A twin id, exactly sources/ids-schema.json line 13. Never invented by the platform."
    }
  },
  "properties": {
    "schema_version": { "const": "1.0" },
    "binding_version": { "type": "integer", "minimum": 1, "description": "Immutable per version; changing anything creates a new one." },
    "entity_id": { "type": "string", "pattern": "^entity/[a-z0-9-]+$", "description": "Platform id; not a twin id." },
    "archetype": { "type": "string", "enum": ["creek", "watershed", "reservoir", "mountain", "bioregion"] },
    "anchor": { "$ref": "#/$defs/placeId", "description": "The place whose headline need leads the page." },
    "stream_id": {
      "oneOf": [{ "$ref": "#/$defs/placeId" }, { "type": "null" }],
      "description": "place/<stream> once the twin mints stream places (PRD §9.1 #4); null until then."
    },
    "commons_handle": { "type": "string", "description": "front-range-bioregion vault path, read-only, e.g. wiki/places/named/boulder-creek." },
    "members": {
      "type": "array",
      "description": "Every twin id the entity may sense through.",
      "items": {
        "type": "object",
        "required": ["id", "role"],
        "additionalProperties": false,
        "properties": {
          "id": { "$ref": "#/$defs/placeId" },
          "role": {
            "type": "string",
            "enum": ["main_stem_gauge", "gauge", "snotel", "reservoir", "water_quality", "air", "weather", "other"]
          },
          "name": { "type": "string", "description": "Display name at freeze time; the twin's name is authoritative." }
        }
      }
    },
    "watersheds": { "type": "array", "items": { "$ref": "#/$defs/placeId" }, "description": "Polygons for intersection; kind watershed." },
    "reach_ids": { "type": "array", "items": { "type": "string" }, "description": "NHDPlusID strings from network/reaches.geojson (when published)." },
    "boundary": {
      "type": "object",
      "required": ["geometry_urls"],
      "additionalProperties": false,
      "description": "URLs only; the platform stores no geometry.",
      "properties": {
        "geometry_urls": { "type": "array", "items": { "type": "string", "format": "uri" } }
      }
    },
    "needs": {
      "type": "array",
      "minItems": 1,
      "maxItems": 8,
      "description": "4–6 in practice; how they become meters is architecture §9.",
      "items": {
        "type": "object",
        "required": ["need", "property", "places", "agg"],
        "additionalProperties": false,
        "properties": {
          "need": { "type": "string" },
          "property": { "type": "string", "description": "A twin reading property (closed vocabulary) or a live-layer property such as dm." },
          "places": { "type": "array", "items": { "$ref": "#/$defs/placeId" } },
          "agg": { "type": "string", "enum": ["single", "mean", "median", "min", "max", "mean_24h", "max_intersecting"] },
          "weight": { "type": "number", "minimum": 0, "maximum": 1 }
        }
      }
    },
    "membership_rule": { "type": "string", "description": "How membership was derived — the platform's guess, in words." },
    "frozen_at": { "type": "string", "format": "date-time" },
    "reviewed_by": { "type": ["string", "null"], "description": "The steward who froze it; null while it is still the platform's guess." },
    "twin_index_etag": { "type": ["string", "null"], "description": "id/index.json ETag at freeze; null when unknown." }
  }
}
